{
  "$schema": "../Schemas/RemoteTarget.schema.json",
  "id": "virtualbox-ubuntu",
  "provider": "ssh",
  "host": "192.168.56.10",
  "port": 22,
  "user": "celestia",
  "knownHostsFile": "Configs/SSH/known_hosts",
  "sshAgentCredentialRef": "keyforge://targets/virtualbox-ubuntu/ssh-agent",
  "releaseRoot": "/opt/celestia/releases"
}
